"TIENDA_ID","PLAZA_CVE","NIVELSOCIOECONOMICO_DES","ENTORNO_DES","MTS2VENTAS_NUM","PUERTASREFRIG_NUM","CAJONESESTACIONAMIENTO_NUM","LATITUD_NUM","LONGITUD_NUM","SEGMENTO_MAESTRO_DESC","LID_UBICACION_TIENDA","DATASET","direccion","codigo_postal","estado"
76,4,"CD","Hogar",109.21,13,7,25.6064,-100.16801,"Hogar Reunión","UT_DENSIDAD","TRAIN","OXXO, Los Reguiletes, Los Rehiletes, Fresnillo, San Roque, Juárez, Nuevo León, 67254, México","67254","Nuevo León"
62,4,"CD","Base",85.25,12,9,25.64195,-100.11259,"Hogar Reunión","UT_DENSIDAD","TRAIN","Calle Loma De Piedra, Paseo de las Lomas, Benito Juárez, Juárez, Nuevo León, 67255, México","67255","Nuevo León"
762,4,"C","Hogar",0,0,0,25.6793,-100.09175,"Hogar Reunión","UT_DENSIDAD","TRAIN","Calle Toledo, Praderas de San Juan, Juárez, Nuevo León, 67258, México","67258","Nuevo León"
256,4,"C","Hogar",95,10,0,25.65545,-100.12373,"Hogar Reunión","UT_TRAFICO_VEHICULAR","TRAIN","Oxxo, Hacienda San Andrés, Hacienda Santa Lucía, Juárez, Nuevo León, 67255, México","67255","Nuevo León"
78,4,"CD","Hogar",115.44,13,9,25.68897,-100.11577,"Hogar Reunión","UT_DENSIDAD","TRAIN","Avenida del Río, Anzures, Juárez, Nuevo León, 67258, México","67258","Nuevo León"
85,4,"C","Receso",116.98,14,10,25.64717,-100.09112,"Oficinistas","UT_DENSIDAD","TRAIN","5 de Mayo, Centro, Benito Juárez, Juárez, Nuevo León, 67250, México","67250","Nuevo León"
776,4,"C","Hogar",0,0,0,25.61936,-100.12416,"Oficinistas","UT_DENSIDAD","TRAIN","Juárez, Nuevo León, 67255, México","67255","Nuevo León"
86,4,"C","Hogar",116.12,12,9,25.68957,-100.11101,"Hogar Reunión","UT_DENSIDAD","TRAIN","Oxxo, Calle Puerto Cabello, Los Puertos 1° y2° sector, Juárez, Nuevo León, 67258, México","67258","Nuevo León"
89,4,"B","Hogar",115.77,12,9,25.64365,-100.08587,"Hogar Reunión","UT_DENSIDAD","TRAIN","Boulevard Hacienda San José, Benito Juárez, Juárez, Nuevo León, 67250, México","67250","Nuevo León"
778,4,"C","Base",0,0,0,25.64885,-100.08403,"Barrio Competido","UT_TRAFICO_VEHICULAR","TRAIN","Benito Juárez, Juárez, Nuevo León, 67250, México","67250","Nuevo León"
781,4,"C","Hogar",89.47,13,0,25.6386,-100.1923,"Hogar Reunión","UT_DENSIDAD","TRAIN","Calle Tepatitlán, Tierra Propia, Guadalupe, Nuevo León, 67194, México","67194","Nuevo León"
96,4,"C","Base",92.45,11,10,25.64882,-100.11601,"Hogar Reunión","UT_DENSIDAD","TRAIN","Calle Señora Bertha Pérez De González, Residencial San Juan, Benito Juárez, Juárez, Nuevo León, 67255, México","67255","Nuevo León"
782,4,"C","Hogar",0,0,0,25.6037,-100.1814,"Barrio Competido","UT_DENSIDAD","TRAIN","Calle Cerro De La Campana, Privadas de La Silla, Juárez, Nuevo León, 67254, México","67254","Nuevo León"
787,4,"C","Hogar",0,0,0,25.61143,-100.14326,"Barrio Competido","UT_DENSIDAD","TRAIN","Monte Ideal, Monte Kristal, Juárez, Nuevo León, 67276, México","67276","Nuevo León"
476,4,"C","Base",97.14,13,17,25.65174,-100.16009,"Hogar Reunión","UT_GAS_URBANA","TRAIN","Avenida Paseo de Guadalupe, Guadalupe, Nuevo León, 67199, México","67199","Nuevo León"
573,4,"C","Hogar",0,13,0,25.61552,-100.15421,"Hogar Reunión","UT_DENSIDAD","TRAIN","Magdalena, Viviendas Magdalena, Juárez, Nuevo León, 67254, México","67254","Nuevo León"
491,4,"B","Hogar",0,13,0,25.61903,-100.14562,"Hogar Reunión","UT_DENSIDAD","TRAIN","Avenida Las Torres, Monte Kristal, Juárez, Nuevo León, 67276, México","67276","Nuevo León"
576,4,"C","Hogar",110.74,12,5,25.65319,-100.20294,"Hogar Reunión","UT_DENSIDAD","TRAIN","Oxxo, Calle Acapulco, Acapulco, Guadalupe, Nuevo León, 67194, México","67194","Nuevo León"
489,4,"B","Hogar",0,13,0,25.63466,-100.15852,"Hogar Reunión","UT_TRAFICO_VEHICULAR","TRAIN","Callejón Camino a Rancho Viejo, Juárez, Nuevo León, 67199, México","67199","Nuevo León"
578,4,"C","Hogar",0,13,0,25.60816,-100.16515,"Hogar Reunión","UT_DENSIDAD","TRAIN","Avenida Acueducto, Santa Mónica, Fresnillo, San Roque, Juárez, Nuevo León, 67254, México","67254","Nuevo León"
488,4,"B","Hogar",0,13,0,25.61455,-100.17592,"Hogar Reunión","UT_DENSIDAD","TRAIN","Oxxo, Calle Santa Alicia, Santa Mónica, Juárez, Nuevo León, 67254, México","67254","Nuevo León"
487,4,"B","Hogar",0,13,0,25.63661,-100.17872,"Hogar Reunión","UT_DENSIDAD","TRAIN","Oxxo, Jesús García, Heroes de Nacozari, Juárez, Nuevo León, 67280, México","67280","Nuevo León"
354,4,"C","Base",101,10,10,25.65599,-100.18227,"Oficinistas","UT_GAS_URBANA","TRAIN","Oxxo, Avenida Maestro Israel Cavazos Garza, Guadalupe, Nuevo León, 67193, México","67193","Nuevo León"
579,4,"C","Hogar",0,0,0,25.66445,-100.1007,"Hogar Reunión","UT_DENSIDAD","TRAIN","Vista de Huizache, Vistas del Río, Benito Juárez, Juárez, Nuevo León, 67258, México","67258","Nuevo León"
478,4,"C","Hogar",78.49,11,8,25.63906,-100.18691,"Hogar Reunión","UT_DENSIDAD","TRAIN","Jardines de La Silla, Tierra Propia, Guadalupe, Nuevo León, 67280, México","67280","Nuevo León"
477,4,"C","Hogar",0,13,0,25.69536,-100.117,"Hogar Reunión","UT_DENSIDAD","TRAIN","París, Anzures, Juárez, Nuevo León, 66670, México","66670","Nuevo León"
569,4,"C","Receso",0,13,0,25.62041,-100.10528,"Parada Técnica","UT_CARRETERA_GAS","TRAIN","Oxxo Gas, Carretera a San Mateo, Los Huertos, Benito Juárez, Juárez, Nuevo León, 67294, México","67294","Nuevo León"
325,4,"C","Hogar",103,10,9,25.68066,-100.1747,"Hogar Reunión","UT_DENSIDAD","TRAIN","Oxxo, Avenida Camino a las Escobas, Dos Ríos, Guadalupe, Nuevo León, 67169, México","67169","Nuevo León"
586,4,"C","Base",102.14,12,0,25.6606,-100.15012,"Clásico","UT_TRAFICO_VEHICULAR","TRAIN","Carretera a Reynosa, Nuevo León, Guadalupe, Nuevo León, 67199, México","67199","Nuevo León"
323,4,"C","Hogar",103,11,7,25.65474,-100.19161,"Hogar Reunión","UT_DENSIDAD","TRAIN","Calle Fátima, Santa María, Guadalupe, Nuevo León, 67198, México","67198","Nuevo León"
357,4,"C","Hogar",99.48,13,17,25.64439,-100.18586,"Hogar Reunión","UT_GAS_URBANA","TRAIN","Oxxo, Avenida Acueducto, Guadalupe, Nuevo León, 67193, México","67193","Nuevo León"
469,4,"C","Base",110.53,13,12,25.67482,-100.19868,"Parada Técnica","UT_DENSIDAD","TRAIN","San Antonio, Los Lermas, Guadalupe, Nuevo León, 67188, México","67188","Nuevo León"
589,4,"C","Hogar",107.21,13,0,25.63988,-100.19627,"Hogar Reunión","UT_DENSIDAD","TRAIN","Avenida Maestro Israel Cavazos Garza, Rincón de la Sierra, Guadalupe, Nuevo León, 67194, México","67194","Nuevo León"
466,4,"C","Hogar",77.01,11,5,25.65171,-100.19697,"Hogar Reunión","UT_DENSIDAD","TRAIN","Avenida Profesor Eloy Cavazos, Santa María, Guadalupe, Nuevo León, 67194, México","67194","Nuevo León"
463,4,"CD","Hogar",117.62,13,9,25.66278,-100.17165,"Hogar Reunión","UT_DENSIDAD","TRAIN","Avenida Vaquerías, Valle del Sol, Guadalupe, Nuevo León, 67199, México","67199","Nuevo León"
592,4,"C","Hogar",104.63,13,0,25.64027,-100.20374,"Hogar Reunión","UT_DENSIDAD","TRAIN","Callejón Villas De Marsella, Rincón de la Sierra, Guadalupe, Nuevo León, 67194, México","67194","Nuevo León"
454,4,"C","Hogar",133.34,13,7,25.68396,-100.17319,"Hogar Reunión","UT_DENSIDAD","TRAIN","Rio la Plata, Dos Ríos, Guadalupe, Nuevo León, 67116, México","67116","Nuevo León"
313,4,"C","Hogar",101,13,9,25.66092,-100.1955,"Hogar Reunión","UT_DENSIDAD","TRAIN","Oxxo, Pablo Livas, Zertuche, Guadalupe, Nuevo León, 67202, México","67202","Nuevo León"
342,4,"C","Hogar",90,10,7,25.65693,-100.17219,"Hogar Reunión","UT_DENSIDAD","TRAIN","Oxxo, Avenida Xochimilco, Xochimilco, Guadalupe, Nuevo León, 67199, México","67199","Nuevo León"
343,4,"C","Hogar",113,11,11,25.6585,-100.1898,"Hogar Reunión","UT_DENSIDAD","TRAIN","Avenida Pablo Livas, 3 Caminos, Guadalupe, Nuevo León, 67190, México","67190","Nuevo León"
542,4,"B","Hogar",0,13,0,25.6263,-100.09652,"Hogar Reunión","UT_DENSIDAD","TRAIN","OXXO, Avenida Las Lomas, Las Lomas, Los Huertos, Benito Juárez, Juárez, Nuevo León, 67262, México","67262","Nuevo León"
543,4,"B","Hogar",0,13,0,25.65013,-100.07336,"Hogar Reunión","UT_DENSIDAD","TRAIN","Avenida Paseo De San Juan, Rinconada San Juan, Benito Juárez, Juárez, Nuevo León, 67250, México","67250","Nuevo León"
544,4,"B","Hogar",0,13,0,25.64653,-100.06443,"Hogar Reunión","UT_TRAFICO_VEHICULAR","TRAIN","Efrain, Mirador San Antonio, Benito Juárez, Juárez, Nuevo León, 67250, México","67250","Nuevo León"
532,4,"B","Hogar",0,13,0,25.68988,-100.10206,"Barrio Competido","UT_DENSIDAD","TRAIN","Oxxo Lomas Anzures, Calle Loma Larga Poniente, Lomas Anzures y Puertos 4, Juárez, Nuevo León, 67258, México","67258","Nuevo León"
531,4,"C","Hogar",119,13,11,25.66834,-100.20095,"Hogar Reunión","UT_DENSIDAD","TRAIN","Avenida Las Torres, La Playa, Guadalupe, Nuevo León, 67188, México","67188","Nuevo León"
546,4,"B","Hogar",0,13,0,25.62223,-100.09129,"Hogar Reunión","UT_DENSIDAD","TRAIN","Calle Desierto De Atacama, Praderas de Oriente, Benito Juárez, Juárez, Nuevo León, 67262, México","67262","Nuevo León"
547,4,"B","Base",0,13,0,25.66161,-100.14385,"Hogar Reunión","UT_TRAFICO_VEHICULAR","TRAIN","Avenida Coahuila, Nuevo León, Juárez, Nuevo León, 67255, México","67255","Nuevo León"
529,4,"B","Hogar",0,13,0,25.64248,-100.1225,"Hogar Reunión","UT_DENSIDAD","TRAIN","Avenida Esperanza, La Esperanza, Juárez, Nuevo León, 67255, México","67255","Nuevo León"
527,4,"B","Hogar",0,13,0,25.64268,-100.10129,"Hogar Reunión","UT_DENSIDAD","TRAIN","Calle Encino, Haciendas de Villa Juárez, Benito Juárez, Juárez, Nuevo León, 67250, México","67250","Nuevo León"
524,4,"B","Hogar",0,13,0,25.64402,-100.05898,"Hogar Reunión","UT_DENSIDAD","TRAIN","Oxxo, Funitas, Mirador San Antonio, Juárez, Nuevo León, 67262, México","67262","Nuevo León"
551,4,"C","Hogar",0,13,0,25.66131,-100.10421,"Hogar Reunión","UT_DENSIDAD","TRAIN","OXXO, Circunvalación Vista del Sabino, Vistas del Río, Benito Juárez, Juárez, Nuevo León, 67250, México","67250","Nuevo León"
301,4,"C","Hogar",120,10,10,25.64824,-100.1831,"Hogar Reunión","UT_DENSIDAD","TRAIN","Oxxo, Calle Jardines de Aragón, Jardines de Andalucia, Guadalupe, Nuevo León, 67193, México","67193","Nuevo León"
552,4,"C","Hogar",0,13,0,25.62981,-100.09465,"Hogar Reunión","UT_DENSIDAD","TRAIN","Avenida Pablo Livas, Las Lomas, Benito Juárez, Juárez, Nuevo León, 67262, México","67262","Nuevo León"
344,4,"C","Hogar",113.11,10,12,25.65219,-100.20159,"Hogar Reunión","UT_TRAFICO_VEHICULAR","TRAIN","Oxxo, Calle Manantial, Campestre La Silla, Guadalupe, Nuevo León, 67194, México","67194","Nuevo León"
517,4,"B","Hogar",0,13,0,25.68302,-100.0874,"Hogar Reunión","UT_DENSIDAD","TRAIN","Mina san geronimo, Urbi Villa del Real, Juárez, Nuevo León, 67258, México","67258","Nuevo León"
515,4,"B","Hogar",0,13,0,25.63215,-100.09914,"Hogar Reunión","UT_TRAFICO_VEHICULAR","TRAIN","Carretera a San Mateo, Benito Juárez, Juárez, Nuevo León, 67262, México","67262","Nuevo León"
558,4,"C","Hogar",108.4,13,6,25.66055,-100.15006,"Hogar Reunión","UT_DENSIDAD","TRAIN","Carretera a Reynosa, Nuevo León, Guadalupe, Nuevo León, 67199, México","67199","Nuevo León"
561,4,"C","Hogar",117.26,13,11,25.66779,-100.1394,"Hogar Reunión","UT_DENSIDAD","TRAIN","Profesor Alfredo González Treviño, 31 de Diciembre, Guadalupe, Nuevo León, 67255, México","67255","Nuevo León"
508,4,"B","Hogar",0,13,0,25.61912,-100.12962,"Hogar Reunión","UT_DENSIDAD","TRAIN","OXXO, Boulevard San Antonio, San Francisco, La Paz, Juárez, Nuevo León, 67255, México","67255","Nuevo León"
335,4,"C","Hogar",119.72,13,0,25.68401,-100.17951,"Hogar Reunión","UT_DENSIDAD","TRAIN","Calle Río Nilo, Dos Ríos, Guadalupe, Nuevo León, 67169, México","67169","Nuevo León"
565,4,"C","Hogar",0,13,0,25.66704,-100.10666,"Hogar Reunión","UT_DENSIDAD","TRAIN","Avenida El Sabinal, Privadas Ocania, Benito Juárez, Juárez, Nuevo León, 67258, México","67258","Nuevo León"
347,4,"CD","Hogar",118,10,0,25.62776,-100.15437,"Hogar Reunión","UT_DENSIDAD","TRAIN","7-Eleven, Calle Hacienda San José, Hacienda San Marcos, Juárez, Nuevo León, 67276, México","67276","Nuevo León"
505,4,"B","Base",0,13,0,25.61653,-100.14059,"Hogar Reunión","UT_DENSIDAD","TRAIN","Avenida Monte Kristal, Monte Kristal, Juárez, Nuevo León, 67276, México","67276","Nuevo León"
566,4,"C","Hogar",0,13,0,25.61549,-100.16955,"Hogar Reunión","UT_DENSIDAD","TRAIN","Avenida Acueducto, Santa Mónica, Juárez, Nuevo León, 67254, México","67254","Nuevo León"
499,4,"B","Hogar",0,13,0,25.61784,-100.17803,"Hogar Reunión","UT_DENSIDAD","TRAIN","Calle San Roberto, La Trinidad, Juárez, Nuevo León, 67280, México","67280","Nuevo León"
378,4,"C","Hogar",101.61,13,10,25.63521,-100.19571,"Hogar Reunión","UT_DENSIDAD","TRAIN","Oxxo, Tequila, Misión de la Silla, Guadalupe, Nuevo León, 67194, México","67194","Nuevo León"
613,4,"C","Hogar",0,13,0,25.66542,-100.12747,"Hogar Reunión","UT_DENSIDAD","TRAIN","Oxxo, Avenida Colinas del Sol, Juárez, Nuevo León, 67255, México","67255","Nuevo León"
377,4,"C","Base",101.92,12,10,25.67398,-100.19056,"Oficinistas","UT_GAS_URBANA","TRAIN","Oxxo, Calle Cerro de la Silla, Cerro de La Silla, Guadalupe, Nuevo León, 67188, México","67188","Nuevo León"
624,4,"C","Hogar",0,0,0,25.63117,-100.10429,"Hogar Reunión","UT_DENSIDAD","TRAIN","Avenida los Portales, Portal de Juárez, Benito Juárez, Juárez, Nuevo León, 67262, México","67262","Nuevo León"
609,4,"C","Hogar",112.76,13,7,25.6568,-100.20271,"Hogar Reunión","UT_DENSIDAD","TRAIN","Calle Profesor Eulogio Flores, Zertuche, Guadalupe, Nuevo León, 67194, México","67194","Nuevo León"
625,4,"C","Hogar",0,0,0,25.62271,-100.12389,"Barrio Competido","UT_DENSIDAD","TRAIN","OXXO san Antonio 1, Retorno San Martín, San Francisco, Juárez, Nuevo León, 67255, México","67255","Nuevo León"
437,4,"D","Hogar",132.58,13,10,25.6505,-100.19497,"Hogar Reunión","UT_DENSIDAD","TRAIN","Avenida Monterrey, Portales de la Silla, Guadalupe, Nuevo León, 67198, México","67198","Nuevo León"
607,4,"C","Base",113.87,13,0,25.65072,-100.17396,"Hogar Reunión","UT_TRAFICO_VEHICULAR","TRAIN","Avenida Xochimilco, Guadalupe, Nuevo León, 67199, México","67199","Nuevo León"
405,4,"C","Base",114.35,13,11,25.67513,-100.19265,"Oficinistas","UT_GAS_URBANA","TRAIN","Avenida La Senda, Los Lermas, Guadalupe, Nuevo León, 67188, México","67188","Nuevo León"
606,4,"C","Hogar",0,13,0,25.66378,-100.12145,"Hogar Reunión","UT_DENSIDAD","TRAIN","Calle Las Bugambilias, Paseo las Margaritas, Las Margaritas, Benito Juárez, Juárez, Nuevo León, 67255, México","67255","Nuevo León"
614,4,"C","Hogar",0,0,0,25.69467,-100.10876,"Hogar Reunión","UT_DENSIDAD","TRAIN","1066, Avenida San Remo, Los Puertos 1° y2° sector, Juárez, Nuevo León, 67258, México","67258","Nuevo León"
628,4,"C","Hogar",0,0,0,25.62308,-100.11947,"Hogar Reunión","UT_DENSIDAD","TRAIN","Callejón Paseo de los Marístas, Fuentes del Seminario, Benito Juárez, Juárez, Nuevo León, 67255, México","67255","Nuevo León"
602,4,"C","Hogar",119.59,12,0,25.64834,-100.20994,"Hogar Reunión","UT_DENSIDAD","TRAIN","Calle Profesor Israel Cavazos, Villa Olimpica, Guadalupe, Nuevo León, 67194, México","67194","Nuevo León"
632,4,"C","Hogar",0,0,0,25.67265,-100.10799,"Hogar Reunión","UT_DENSIDAD","TRAIN","Juárez, Nuevo León, 67258, México","67258","Nuevo León"
601,4,"C","Hogar",115.58,13,10,25.6537,-100.15693,"Hogar Reunión","UT_DENSIDAD","TRAIN","Camino a Vaquerias, Monteverde, Guadalupe, Nuevo León, 67199, México","67199","Nuevo León"
379,4,"C","Hogar",84.9,12,8,25.66388,-100.20391,"Hogar Reunión","UT_TRAFICO_VEHICULAR","TRAIN","Avenida Evolución, Tacubaya, Guadalupe, Nuevo León, 67188, México","67188","Nuevo León"
637,4,"C","Hogar",0,0,0,25.66896,-100.1318,"Hogar Reunión","UT_DENSIDAD","TRAIN","Guadalupe, Nuevo León, 67255, México","67255","Nuevo León"
619,4,"C","Hogar",0,0,0,25.69338,-100.11017,"Hogar Reunión","UT_DENSIDAD","TRAIN","Bahía Central, Los Puertos 1° y2° sector, Juárez, Nuevo León, 67258, México","67258","Nuevo León"
421,4,"C","Hogar",124.98,13,11,25.65846,-100.16494,"Hogar Reunión","UT_DENSIDAD","TRAIN","Avenida del Bosque, Guadalupe, Nuevo León, 67199, México","67199","Nuevo León"
305,4,"B","Base",84,10,9,25.6634,-100.1497,"Clásico","UT_DENSIDAD","TRAIN","Calle Uranio, Plaza El Molinete, Guadalupe, Nuevo León, 67199, México","67199","Nuevo León"
312,4,"C","Hogar",128,13,11,25.64689,-100.17775,"Hogar Reunión","UT_DENSIDAD","TRAIN","Oxxo, Avenida Profesor Eloy Cavazos, Mision Santa Fe, Guadalupe, Nuevo León, 67193, México","67193","Nuevo León"
617,4,"C","Hogar",0,0,0,25.65422,-100.07998,"Barrio Competido","UT_DENSIDAD","TRAIN","Calle Alhelí, Villas de San Jose, Benito Juárez, Juárez, Nuevo León, 67250, México","67250","Nuevo León"
397,4,"C","Hogar",107.52,11,6,25.6812,-100.17201,"Hogar Reunión","UT_DENSIDAD","TRAIN","Oxxo, Río Missouri, Dos Ríos, Guadalupe, Nuevo León, 67116, México","67116","Nuevo León"
416,4,"C","Hogar",101.73,12,8,25.65194,-100.18565,"Hogar Reunión","UT_DENSIDAD","TRAIN","Oxxo, Avenida Maestro Israel Cavazos Garza, Guadalupe, Nuevo León, 67193, México","67193","Nuevo León"
381,5,"C","Base",107.18,12,6,25.78953,-100.19482,"Parada Técnica","UT_GAS_URBANA","TRAIN","Oxxo, Carretera A Santa Rosa, Apodaca, Nuevo León, 66623, México","66623","Nuevo León"
513,5,"C","Hogar",106.69,13,8,25.80144,-100.21888,"Hogar Reunión","UT_DENSIDAD","TRAIN","Apodaca, Nuevo León, 66610, México","66610","Nuevo León"
512,5,"B","Hogar",98.66,13,7,25.75565,-100.10629,"Hogar Reunión","UT_DENSIDAD","TRAIN","Oxxo, Calle Lucca, Cantoral, Pesquería, Nuevo León, 66673, México","66673","Nuevo León"
382,5,"C","Hogar",107.27,13,7,25.70592,-100.1009,"Barrio Competido","UT_DENSIDAD","TRAIN","OXXO, Calle Carmín, Valle de Santa María, Pesquería, Nuevo León, 66670, México","66670","Nuevo León"
415,5,"C","Hogar",99.9,13,10,25.74753,-100.15064,"Hogar Reunión","UT_DENSIDAD","TRAIN","San Miguel Arcángel, Misión San Javier, Apodaca, Nuevo León, 66644, México","66644","Nuevo León"
203,5,"CD","Base",109.41,12,11,25.74875,-100.22658,"Hogar Reunión","UT_TRAFICO_VEHICULAR","TRAIN","Oxxo, Avenida Camino al Mezquital, Apodaca, Nuevo León, 66630, México","66630","Nuevo León"
384,5,"C","Hogar",116.15,13,7,25.70345,-100.09608,"Hogar Reunión","UT_DENSIDAD","TRAIN","Avenida San Fernando, Valle de Santa María, Pesquería, Nuevo León, 66670, México","66670","Nuevo León"
871,5,"C","Hogar",0,0,0,25.79852,-100.22754,"Hogar Reunión","UT_DENSIDAD","TRAIN","Calle Eucalipto, Prados de Santa Rosa, Apodaca, Nuevo León, 66610, México","66610","Nuevo León"
383,5,"C","Hogar",107.4,13,9,25.70929,-100.10361,"Parada Técnica","UT_DENSIDAD","TRAIN","Parroquia Nuestra Señora Del Roble, 650, Avenida San Fernando, Valle de Santa María, Pesquería, Nuevo León, 66670, México","66670","Nuevo León"
872,5,"C","Hogar",0,0,0,25.76884,-100.15083,"Hogar Reunión","UT_DENSIDAD","TRAIN","Avenida Trevoles, Los Tréboles, Apodaca, Nuevo León, 66646, México","66646","Nuevo León"
418,5,"CD","Hogar",119.18,12,9,25.75359,-100.15279,"Hogar Reunión","UT_DENSIDAD","TRAIN","Oxxo, Calle San Benito, San Benito, Apodaca, Nuevo León, 66644, México","66644","Nuevo León"
202,5,"C","Base",80.28,10,5,25.82094,-100.22097,"Hogar Reunión","UT_DENSIDAD","TRAIN","Calle Eulalio Gutiérrez, Santa Rosa, Apodaca, Nuevo León, 66610, México","66610","Nuevo León"
412,5,"C","Hogar",115.2,12,9,25.80539,-100.21943,"Hogar Reunión","UT_DENSIDAD","TRAIN","Oxxo Villas de Santa Rosa, Avenida Paseo de las Flores, Villas de Santa Rosa, Apodaca, Nuevo León, 66610, México","66610","Nuevo León"
393,5,"C","Hogar",112.3,12,8,25.82126,-100.10702,"Hogar Reunión","UT_DENSIDAD","TRAIN","Oxxo, Calle Tlaxcala, Arcos del Parque, Colinas del Aeropuerto, Pesquería, Nuevo León, 66655, México","66655","Nuevo León"
235,5,"C","Base",126.41,12,9,25.78424,-100.26629,"Hogar Reunión","UT_DENSIDAD","TRAIN","Calle Margaritas, Apodaca, Nuevo León, 66612, México","66612","Nuevo León"
394,5,"C","Hogar",111.77,13,9,25.81771,-100.1078,"Hogar Reunión","UT_DENSIDAD","TRAIN","Calle San Nicolás, Colinas del Aeropuerto, Pesquería, Nuevo León, 66655, México","66655","Nuevo León"
535,5,"C","Base",114.38,13,9,25.78523,-100.19049,"Parada Técnica","UT_TRAFICO_PEATONAL","TRAIN","OXXO, Calle José María Morelos, Centro Apodaca, Apodaca, Nuevo León, 66623, México","66623","Nuevo León"
534,5,"C","Hogar",115.02,13,0,25.80848,-100.2275,"Hogar Reunión","UT_DENSIDAD","TRAIN","Avenida del Lago, Privadas de Santa Rosa, Apodaca, Nuevo León, 66610, México","66610","Nuevo León"
533,5,"C","Hogar",117.29,13,6,25.76443,-100.26214,"Hogar Reunión","UT_DENSIDAD","TRAIN","Calle Josefa Madrigal, Mujeres Ilustres, Apodaca, Nuevo León, 66636, México","66636","Nuevo León"
398,5,"C","Hogar",95.97,13,8,25.76204,-100.13888,"Hogar Reunión","UT_DENSIDAD","TRAIN","Oxxo, Praga, Paseo de las Flores, Apodaca, Nuevo León, 66646, México","66646","Nuevo León"
821,5,"C","Hogar",0,0,0,25.78159,-100.24528,"Hogar Reunión","UT_DENSIDAD","TRAIN","354, Avenida Paseo de los Pinos, Bosques Real II, Apodaca, Nuevo León, 66636, México","66636","Nuevo León"
399,5,"D","Hogar",108.42,13,9,25.8141,-100.25587,"Hogar Reunión","UT_DENSIDAD","TRAIN","Oxxo, Calle Doctor Martín Luther King, Los Amarantos, Apodaca, Nuevo León, 66612, México","66612","Nuevo León"
385,5,"CD","Hogar",112.95,13,9,25.71077,-100.09625,"Barrio Competido","UT_DENSIDAD","TRAIN","Valle de Santa María, Pesquería, Nuevo León, 66670, México","66670","Nuevo León"
388,5,"C","Hogar",111.77,13,9,25.82395,-100.12135,"Hogar Reunión","UT_DENSIDAD","TRAIN","Oxxo, Calle Loma Larga, Pesquería, Nuevo León, 66655, México","66655","Nuevo León"
403,5,"C","Hogar",109.73,13,9,25.8132,-100.10732,"Parada Técnica","UT_DENSIDAD","TRAIN","Calle Soto La Marina, Colinas del Aeropuerto, Pesquería, Nuevo León, 66655, México","66655","Nuevo León"
831,5,"B","Hogar",0,0,0,25.80079,-100.19156,"Hogar Reunión","UT_DENSIDAD","TRAIN","Oxxo, Paseo Rinconada Colonial, Katavia Residencial, Apodaca, Nuevo León, 66623, México","66623","Nuevo León"
833,5,"C","Hogar",0,0,0,25.8173,-100.234,"Hogar Reunión","UT_DENSIDAD","TRAIN","Boulevard Cardenal, Apodaca, Nuevo León, 66610, México","66610","Nuevo León"
836,5,"C","Hogar",0,0,0,25.796,-100.2677,"Hogar Reunión","UT_DENSIDAD","TRAIN","Calle Bugambilias, Valle de las Palmas V, Apodaca, Nuevo León, 66612, México","66612","Nuevo León"
387,5,"C","Hogar",118.08,12,4,25.75882,-100.17007,"Barrio Competido","UT_TRAFICO_VEHICULAR","TRAIN","OXXO, Río de Oro, Pueblo Nuevo V, Apodaca, Nuevo León, 66645, México","66645","Nuevo León"
217,5,"CD","Hogar",115.81,10,14,25.79035,-100.26302,"Hogar Reunión","UT_DENSIDAD","TRAIN","Oxxo, Avenida Andrómeda, Andalucia, Apodaca, Nuevo León, 66612, México","66612","Nuevo León"
386,5,"C","Hogar",107.1,12,13,25.70686,-100.09634,"Oficinistas","UT_DENSIDAD","TRAIN","Valle de Santa María, Pesquería, Nuevo León, 66670, México","66670","Nuevo León"
849,5,"C","Hogar",0,0,0,25.85841,-99.94211,"Barrio Competido","UT_DENSIDAD","TRAIN","Calle 5 de Mayo, Doctor González, Nuevo León, México",NA,"Nuevo León"
459,5,"C","Hogar",82.92,12,8,25.73927,-100.14431,"Hogar Reunión","UT_DENSIDAD","TRAIN","Oxxo, Avenida Misión San Pablo, Mision San Pablo, Apodaca, Nuevo León, 66644, México","66644","Nuevo León"
136,5,"CD","Hogar",107.9,10,13,25.77565,-100.26596,"Hogar Reunión","UT_DENSIDAD","TRAIN","Calle Calabacilla, Apodaca, Nuevo León, 66636, México","66636","Nuevo León"
468,5,"C","Hogar",115,13,7,25.82092,-100.23078,"Hogar Reunión","UT_DENSIDAD","TRAIN","354, Avenida Golondrinas, Paseo de Santa Rosa, Apodaca, Nuevo León, 66610, México","66610","Nuevo León"
467,5,"C","Hogar",121.19,13,0,25.82195,-100.23402,"Hogar Reunión","UT_DENSIDAD","TRAIN","Boulevard Cardenal, Apodaca, Nuevo León, 66610, México","66610","Nuevo León"
371,5,"C","Peatonal",95,10,4,25.77614,-100.18724,"Oficinistas","UT_TRAFICO_PEATONAL","TRAIN","Crédito Vanguardia, Boulevard Carlos Salinas de Gortari, Apodaca, Nuevo León, 66600, México","66600","Nuevo León"
465,5,"C","Base",121.28,13,12,25.77893,-100.25511,"Hogar Reunión","UT_TRAFICO_VEHICULAR","TRAIN","Avenida Afganistán, Apodaca, Nuevo León, 66636, México","66636","Nuevo León"
359,5,"C","Hogar",66.24,10,9,25.79337,-100.23526,"Hogar Reunión","UT_DENSIDAD","TRAIN","Avenida Álamo, Apodaca, Nuevo León, 66610, México","66610","Nuevo León"
462,5,"C","Base",64.51,10,8,25.7795,-100.1882,"Oficinistas","UT_TRAFICO_PEATONAL","TRAIN","OXXO, Calle Ignacio Allende, Centro Apodaca, Apodaca, Nuevo León, 66600, México","66600","Nuevo León"
461,5,"C","Hogar",99.45,12,3,25.76057,-100.2168,"Hogar Reunión","UT_DENSIDAD","TRAIN","Oxxo, Avenida Santa Teresa de Jesús, Ex Hacienda San Francisco, Apodaca, Nuevo León, 66632, México","66632","Nuevo León"
137,5,"D","Hogar",128.96,12,10,25.78499,-100.25311,"Hogar Reunión","UT_GAS_URBANA","TRAIN","Oxxo, Avenida de la Concordia, Apodaca, Nuevo León, 66636, México","66636","Nuevo León"
362,5,"C","Base",96,10,11,25.81464,-100.217,"Hogar Reunión","UT_GAS_URBANA","TRAIN","Oxxo, Calle Profesor Humberto Ramos Lozano, Apodaca, Nuevo León, 66610, México","66610","Nuevo León"
115,5,"BC","Receso",160.2,12,0,25.78965,-100.14666,"Parada Técnica","UT_CARRETERA_GAS","TRAIN","Avenida Miguel Alemán, Apodaca, Nuevo León, 66626, México","66626","Nuevo León"
363,5,"C","Hogar",115.79,13,11,25.81966,-100.25688,"Hogar Reunión","UT_DENSIDAD","TRAIN","Privada Nixon, Los Amarantos, Apodaca, Nuevo León, 66612, México","66612","Nuevo León"
364,5,"C","Hogar",108.21,10,12,25.74235,-100.21792,"Clásico","UT_GAS_URBANA","TRAIN","Oxxo, Avenida José María, Apodaca, Nuevo León, 66478, México","66478","Nuevo León"
