"TIENDA_ID","PLAZA_CVE","NIVELSOCIOECONOMICO_DES","ENTORNO_DES","MTS2VENTAS_NUM","PUERTASREFRIG_NUM","CAJONESESTACIONAMIENTO_NUM","LATITUD_NUM","LONGITUD_NUM","SEGMENTO_MAESTRO_DESC","LID_UBICACION_TIENDA","DATASET","direccion","codigo_postal","estado"
907,2,"C","Hogar",104.2,10,10,26.05555,-98.34134,"Hogar Reunión","UT_DENSIDAD","TRAIN","Oxxo, Calle Campeche, Reynosa, Tamaulipas, 88500, México","88500","Tamaulipas"
908,2,"CD","Hogar",105.1,10,13,26.04733,-98.29975,"Hogar Reunión","UT_TRAFICO_VEHICULAR","TRAIN","Calle Tercera, Reynosa, Tamaulipas, 88500, México","88500","Tamaulipas"
909,2,"C","Hogar",95,7,6,26.05964,-98.30874,"Hogar Reunión","UT_DENSIDAD","TRAIN","Calle Cerro Azul, Reynosa, Tamaulipas, 88500, México","88500","Tamaulipas"
911,2,"CD","Hogar",123.4,10,5,26.01801,-98.24324,"Hogar Reunión","UT_DENSIDAD","TRAIN","Calle Ágatha, Reynosa, Tamaulipas, 88500, México","88500","Tamaulipas"
912,2,"C","Hogar",108,10,8,26.0085,-98.24256,"Hogar Reunión","UT_DENSIDAD","TRAIN","Avenida Punta Diamante, Reynosa, Tamaulipas, 88500, México","88500","Tamaulipas"
913,2,"C","Hogar",98.36,10,10,26.05574,-98.28835,"Hogar Reunión","UT_DENSIDAD","TRAIN","Oxxo, Calle Primaveras, Reynosa, Tamaulipas, 88500, México","88500","Tamaulipas"
914,2,"B","Receso",112.3,10,10,26.04321,-97.95335,"Parada Técnica","UT_GAS_URBANA","TRAIN","Avenida Licenciado Benito Juárez, Nuevo Progreso, Río Bravo, Tamaulipas, México",NA,"Tamaulipas"
915,2,"C","Hogar",105.74,10,10,26.07616,-98.28808,"Parada Técnica","UT_TRAFICO_VEHICULAR","TRAIN","Calle Culiacán, Reynosa, Tamaulipas, 88500, México","88500","Tamaulipas"
916,2,"C","Receso",92,10,6,26.05247,-97.95191,"Parada Técnica","UT_DENSIDAD","TRAIN","Avenida Licenciado Benito Juárez, Nuevo Progreso, Río Bravo, Tamaulipas, México",NA,"Tamaulipas"
917,2,"C","Hogar",214.2,10,14,26.06344,-98.37474,"Hogar Reunión","UT_DENSIDAD","TRAIN","Calle de los Robles, Reynosa, Tamaulipas, 88500, México","88500","Tamaulipas"
883,2,"C","Receso",103.3,10,8,26.0646,-98.2845,"Clásico","UT_GAS_URBANA","TRAIN","Oxxo, Boulevard General Álvaro Obregón, Reynosa, Tamaulipas, 88500, México","88500","Tamaulipas"
865,2,"C","Hogar",0,0,0,26.00448,-98.25235,"Hogar Reunión","UT_DENSIDAD","TRAIN","Boulevard Villas de Esmeralda, Reynosa, Tamaulipas, 88500, México","88500","Tamaulipas"
866,2,"C","Receso",0,0,0,26.03853,-98.30021,"Parada Técnica","UT_TRAFICO_VEHICULAR","TRAIN","Avenida Rodolfo Garza Cantú, Reynosa, Tamaulipas, 88500, México","88500","Tamaulipas"
875,2,"BC","Receso",107.7,10,12,26.0857,-98.29232,"Parada Técnica","UT_TRAFICO_VEHICULAR","TRAIN","Boulevard Miguel Hidalgo y Costilla, Reynosa, Tamaulipas, 88500, México","88500","Tamaulipas"
876,2,"BC","Hogar",126,10,10,26.08091,-98.27484,"Clásico","UT_TRAFICO_VEHICULAR","TRAIN","Calle Havre, Reynosa, Tamaulipas, 88500, México","88500","Tamaulipas"
877,2,"CD","Receso",191.2,10,10,26.03791,-98.36191,"Hogar Reunión","UT_DENSIDAD","TRAIN","Avenida Las Lomas, Reynosa, Tamaulipas, 88500, México","88500","Tamaulipas"
2,2,"C","Hogar",0,0,0,26.04198,-98.3562,"Hogar Reunión","UT_DENSIDAD","TRAIN","Oxxo, Calle Loma Dorada, Reynosa, Tamaulipas, 88500, México","88500","Tamaulipas"
879,2,"C","Receso",110,10,10,26.09214,-98.2756,"Oficinistas","UT_TRAFICO_PEATONAL","TRAIN","Calle José María Morelos, Reynosa, Tamaulipas, 88500, México","88500","Tamaulipas"
881,2,"B","Hogar",130,10,10,26.07699,-98.277,"Oficinistas","UT_TRAFICO_VEHICULAR","TRAIN","Boulevard General Lázaro Cárdenas, Reynosa, Tamaulipas, 88500, México","88500","Tamaulipas"
882,2,"B","Receso",110,10,10,26.0883,-98.27013,"Clásico","UT_DENSIDAD","TRAIN","Calle Licenciado Emilio Portes Gil, Reynosa, Tamaulipas, 88500, México","88500","Tamaulipas"
918,2,"C","Hogar",111.75,10,10,26.07442,-98.30989,"Hogar Reunión","UT_DENSIDAD","TRAIN","Calle Padre Soler, Reynosa, Tamaulipas, 88500, México","88500","Tamaulipas"
884,2,"C","Base",122.54,8,12,26.0896,-98.27616,"Oficinistas","UT_TRAFICO_PEATONAL","TRAIN","Calle General Servando Canales, Reynosa, Tamaulipas, 88500, México","88500","Tamaulipas"
885,2,"B","Receso",110.15,10,9,25.98226,-98.09069,"Oficinistas","UT_TRAFICO_PEATONAL","TRAIN","Calle Las Palmas, Río Bravo, Tamaulipas, 88900, México","88900","Tamaulipas"
886,2,"BC","Base",94.3,10,9,26.06934,-98.29477,"Clásico","UT_TRAFICO_VEHICULAR","TRAIN","Calle Rosalinda Guerrero, Reynosa, Tamaulipas, 88500, México","88500","Tamaulipas"
887,2,"C","Receso",188.99,0,11,26.05794,-98.29427,"Oficinistas","UT_TRAFICO_VEHICULAR","TRAIN","Oxxo, Calle General Álvaro Obregón, Reynosa, Tamaulipas, 88500, México","88500","Tamaulipas"
888,2,"C","Hogar",121,10,14,26.06334,-98.28745,"Hogar Reunión","UT_TRAFICO_VEHICULAR","TRAIN","Boulevard Alvaro Obregon, Reynosa, Tamaulipas, 88500, México","88500","Tamaulipas"
889,2,"BC","Hogar",133,10,14,26.07191,-98.27563,"Hogar Reunión","UT_DENSIDAD","TRAIN","Boulevard Poza Rica, Reynosa, Tamaulipas, 88500, México","88500","Tamaulipas"
891,2,"C","Hogar",113.17,12,6,25.97946,-98.06868,"Hogar Reunión","UT_GAS_URBANA","TRAIN","Gasolinera 01, Avenida Francisco I. Madero, Río Bravo, Tamaulipas, 88900, México","88900","Tamaulipas"
892,2,"C","Hogar",110,10,10,26.0774,-98.29348,"Hogar Reunión","UT_DENSIDAD","TRAIN","Calle Insurgentes, Reynosa, Tamaulipas, 88500, México","88500","Tamaulipas"
893,2,"BC","Hogar",124.68,10,11,26.08725,-98.30295,"Hogar Reunión","UT_TRAFICO_VEHICULAR","TRAIN","Calle Manuel Barragán, Reynosa, Tamaulipas, 88500, México","88500","Tamaulipas"
953,2,"C","Hogar",98,10,10,26.08276,-98.28998,"Hogar Reunión","UT_DENSIDAD","TRAIN","Calle Río Frío, Reynosa, Tamaulipas, 88500, México","88500","Tamaulipas"
942,2,"C","Receso",130,12,9,25.9883,-98.11208,"Parada Técnica","UT_GAS_URBANA","TRAIN","Oxxo, Avenida Francisco I. Madero, Río Bravo, Tamaulipas, 88950, México","88950","Tamaulipas"
943,2,"C","Hogar",115,12,10,26.05403,-98.38253,"Hogar Reunión","UT_DENSIDAD","TRAIN","Calle del Valle, Reynosa, Tamaulipas, 88500, México","88500","Tamaulipas"
944,2,"C","Hogar",120,10,10,25.99662,-98.06202,"Hogar Reunión","UT_DENSIDAD","TRAIN","Calle República Mexicana, Río Bravo, Tamaulipas, 88920, México","88920","Tamaulipas"
945,2,"C","Hogar",130,12,14,25.98966,-98.08214,"Hogar Reunión","UT_DENSIDAD","TRAIN","Calle Coahuila, Río Bravo, Tamaulipas, 88900, México","88900","Tamaulipas"
946,2,"C","Hogar",146,10,12,26.03574,-98.39134,"Hogar Reunión","UT_DENSIDAD","TRAIN","Circuito Hacienda del Pinto, Reynosa, Tamaulipas, 88730, México","88730","Tamaulipas"
947,2,"C","Hogar",112,10,11,26.0662,-98.267,"Hogar Reunión","UT_DENSIDAD","TRAIN","Boulevard Espuelas del Ferrocarril, Reynosa, Tamaulipas, 88500, México","88500","Tamaulipas"
948,2,"C","Hogar",117,11,11,26.05154,-98.41472,"Hogar Reunión","UT_DENSIDAD","TRAIN","Oxxo, Calle Paseo de los Fresnos, Fracc. Loma Real, Reynosa, Tamaulipas, 88715, México","88715","Tamaulipas"
949,2,"C","Receso",107,10,10,26.06029,-98.24792,"Hogar Reunión","UT_GAS_URBANA","TRAIN","Reynosa, Tamaulipas, 88500, México","88500","Tamaulipas"
951,2,"C","Receso",130,12,6,26.08338,-98.30352,"Oficinistas","UT_TRAFICO_PEATONAL","TRAIN","Avenida Doctor José Zertuche Ibarra, Reynosa, Tamaulipas, 88500, México","88500","Tamaulipas"
952,2,"C","Receso",130,10,10,26.04772,-98.30035,"Hogar Reunión","UT_GAS_URBANA","TRAIN","Pemex, Avenida Rodolfo Garza Cantú, Reynosa, Tamaulipas, 88500, México","88500","Tamaulipas"
941,2,"C","Hogar",122,11,10,26.00379,-98.25312,"Hogar Reunión","UT_DENSIDAD","TRAIN","Calle Everest, Reynosa, Tamaulipas, 88500, México","88500","Tamaulipas"
954,2,"C","Hogar",116.25,0,10,26.06715,-98.32452,"Hogar Reunión","UT_DENSIDAD","TRAIN","Calle Oriente Dos, Reynosa, Tamaulipas, 88500, México","88500","Tamaulipas"
955,2,"C","Hogar",117,11,12,26.00686,-98.06271,"Barrio Competido","UT_DENSIDAD","TRAIN","Calle Océano Atlántico, Río Bravo, Tamaulipas, 88923, México","88923","Tamaulipas"
956,2,"C","Receso",121,10,10,25.98349,-98.08468,"Hogar Reunión","UT_DENSIDAD","TRAIN","Calle Vicente Guerrero, Río Bravo, Tamaulipas, 88900, México","88900","Tamaulipas"
957,2,"C","Hogar",145,10,13,26.03575,-98.3799,"Hogar Reunión","UT_DENSIDAD","TRAIN","Oxxo, Calle Revolución, Reynosa, Tamaulipas, 88500, México","88500","Tamaulipas"
958,2,"CD","Receso",125,10,12,25.99809,-98.08917,"Parada Técnica","UT_DENSIDAD","TRAIN","Oxxo, Calle Almendro, Río Bravo, Tamaulipas, 88900, México","88900","Tamaulipas"
959,2,"B","Receso",118,11,11,26.06102,-98.29517,"Clásico","UT_TRAFICO_VEHICULAR","TRAIN","Calle 5 de febrero, Reynosa, Tamaulipas, 88500, México","88500","Tamaulipas"
961,2,"C","Receso",109,11,10,26.23095,-98.66727,"Parada Técnica","UT_CARRETERA_GAS","TRAIN","Carretera Nuevo Laredo- Reynosa, La Cuchilla (Los Miranda), Valadeces, Gustavo Díaz Ordaz, Tamaulipas, México",NA,"Tamaulipas"
962,2,"C","Hogar",136,10,12,26.02219,-98.27036,"Hogar Reunión","UT_DENSIDAD","TRAIN","Calle Enrique Canseco, Reynosa, Tamaulipas, 88500, México","88500","Tamaulipas"
963,2,"C","Receso",132,11,12,26.06109,-98.35409,"Hogar Reunión","UT_DENSIDAD","TRAIN","Calle Israel, Reynosa, Tamaulipas, 88500, México","88500","Tamaulipas"
919,2,"BC","Hogar",100,10,10,26.05088,-98.32233,"Hogar Reunión","UT_DENSIDAD","TRAIN","Blvrd las fuentes, Reynosa, Tamaulipas, 88500, México","88500","Tamaulipas"
921,2,"C","Receso",132,10,12,26.00836,-98.20679,"Parada Técnica","UT_GAS_URBANA","TRAIN","Oxxo, Autopista Matamoros-Reynosa, Reynosa, Tamaulipas, 88500, México","88500","Tamaulipas"
922,2,"C","Hogar",143.18,13,12,26.0662,-98.34108,"Hogar Reunión","UT_TRAFICO_VEHICULAR","TRAIN","Avenida San José, Reynosa, Tamaulipas, 88500, México","88500","Tamaulipas"
923,2,"C","Receso",96.36,12,10,26.08281,-98.28388,"Oficinistas","UT_DENSIDAD","TRAIN","Calle Michoacán, Reynosa, Tamaulipas, 88500, México","88500","Tamaulipas"
924,2,"C","Hogar",105.26,12,10,26.06088,-98.28161,"Hogar Reunión","UT_DENSIDAD","TRAIN","Calle Manuel María Ponce, Reynosa, Tamaulipas, 88500, México","88500","Tamaulipas"
925,2,"A","Hogar",77.05,10,8,26.05698,-98.31215,"Hogar Reunión","UT_DENSIDAD","TRAIN","Calle Independencia, Reynosa, Tamaulipas, 88500, México","88500","Tamaulipas"
926,2,"C","Receso",117.23,10,10,26.0284,-98.43882,"Parada Técnica","UT_CARRETERA_GAS","TRAIN","Oxxo, Autopista Reynosa-Monterrey, El Álamo, Reynosa, Tamaulipas, 88733, México","88733","Tamaulipas"
927,2,"C","Receso",135.13,12,12,25.92283,-98.26913,"Parada Técnica","UT_CARRETERA_GAS","TRAIN","Oxxo, Carretera Reynosa-San Fernando, Reynosa, Tamaulipas, México",NA,"Tamaulipas"
928,2,"BC","Receso",112,12,4,26.39945,-99.02597,"Oficinistas","UT_TRAFICO_PEATONAL","TRAIN","Calle Séptima, Miguel Alemán, Tamaulipas, México",NA,"Tamaulipas"
929,2,"C","Hogar",83.07,10,10,25.99169,-98.07486,"Hogar Reunión","UT_DENSIDAD","TRAIN","Oxxo, Calle Naranjo, Río Bravo, Tamaulipas, 88920, México","88920","Tamaulipas"
931,2,"C","Hogar",114,14,12,26.04801,-98.37562,"Hogar Reunión","UT_DENSIDAD","TRAIN","Oxxo, Calle Irlanda, Reynosa, Tamaulipas, 88500, México","88500","Tamaulipas"
932,2,"C","Receso",161.93,14,15,26.38915,-99.0183,"Clásico","UT_CARRETERA_GAS","TRAIN","Pemex, Calle Manuel Cavazos Lerma, Miguel Alemán, Tamaulipas, México",NA,"Tamaulipas"
933,2,"C","Hogar",124,11,10,26.06831,-98.305,"Hogar Reunión","UT_DENSIDAD","TRAIN","Calle San Carlos, Reynosa, Tamaulipas, 88500, México","88500","Tamaulipas"
934,2,"C","Hogar",89.4,10,10,26.05878,-98.29961,"Hogar Reunión","UT_TRAFICO_VEHICULAR","TRAIN","Calle Heriberto Deándar Amador, Reynosa, Tamaulipas, 88500, México","88500","Tamaulipas"
935,2,"C","Hogar",152,13,12,25.99116,-98.09066,"Hogar Reunión","UT_DENSIDAD","TRAIN","Oxxo, Calle Yucatán, Río Bravo, Tamaulipas, 88900, México","88900","Tamaulipas"
936,2,"C","Receso",110,12,10,26.08377,-98.30029,"Clásico","UT_TRAFICO_VEHICULAR","TRAIN","Calle Fresno, Reynosa, Tamaulipas, 88500, México","88500","Tamaulipas"
937,2,"C","Base",75,6,3,26.23352,-98.59779,"Hogar Reunión","UT_GAS_URBANA","TRAIN","Gustavo Díaz Ordaz, Tamaulipas, México",NA,"Tamaulipas"
938,2,"C","Base",132,12,10,26.39773,-99.03788,"Hogar Reunión","UT_GAS_URBANA","TRAIN","Oxxo, Calle Puerto Chetumal, Miguel Alemán, Tamaulipas, México",NA,"Tamaulipas"
939,2,"C","Receso",131.5,12,12,26.02647,-98.44417,"Parada Técnica","UT_CARRETERA_GAS","TRAIN","Banorte, Autopista Reynosa-Monterrey, El Álamo, Reynosa, Tamaulipas, 88733, México","88733","Tamaulipas"
1,2,"C","Hogar",0,0,0,26.00177,-98.24284,"Hogar Reunión","UT_DENSIDAD","TRAIN","Boulevard Villas de Esmeralda, Reynosa, Tamaulipas, 88500, México","88500","Tamaulipas"
19,2,"C","Hogar",0,0,0,25.9944,-98.11901,"Hogar Reunión","UT_DENSIDAD","TRAIN","Calle Brecha 108, Río Bravo, Tamaulipas, 88950, México","88950","Tamaulipas"
18,2,"C","Hogar",0,0,0,26.05197,-98.28736,"Hogar Reunión","UT_DENSIDAD","TRAIN","Calle Adolfo López Mateos, Reynosa, Tamaulipas, 88500, México","88500","Tamaulipas"
17,2,"C","Base",0,0,0,26.05687,-98.36383,"Parada Técnica","UT_TRAFICO_VEHICULAR","TRAIN","BH Business, Calle Los Encinos, Reynosa, Tamaulipas, 88500, México","88500","Tamaulipas"
16,2,"C","Hogar",0,0,0,26.02393,-98.34394,"Hogar Reunión","UT_DENSIDAD","TRAIN","Reynosa, Tamaulipas, 88500, México","88500","Tamaulipas"
15,2,"C","Receso",0,0,0,26.04645,-98.32298,"Hogar Reunión","UT_CARRETERA_GAS","TRAIN","Calle Libramiento Monterrey, Reynosa, Tamaulipas, 88500, México","88500","Tamaulipas"
14,2,"C","Receso",0,0,0,26.21178,-98.5901,"Parada Técnica","UT_CARRETERA_GAS","TRAIN","Pemex, Carretera Nuevo Laredo- Reynosa, La Cuchilla (Los Miranda), Valadeces, Gustavo Díaz Ordaz, Tamaulipas, México",NA,"Tamaulipas"
13,2,"C","Base",0,0,0,25.98686,-98.09433,"Oficinistas","UT_TRAFICO_VEHICULAR","TRAIN","Oxxo, Avenida Francisco I. Madero, Río Bravo, Tamaulipas, 88950, México","88950","Tamaulipas"
12,2,"C","Hogar",0,0,0,25.99668,-98.26116,"Hogar Reunión","UT_DENSIDAD","TRAIN","Reynosa, Tamaulipas, 88500, México","88500","Tamaulipas"
11,2,"C","Hogar",0,0,0,26.00828,-98.40705,"Hogar Reunión","UT_DENSIDAD","TRAIN","Calle Flor de Pensamiento, Itavu, Reynosa, Tamaulipas, 88733, México","88733","Tamaulipas"
8,2,"C","Base",0,0,0,26.04768,-98.2894,"Hogar Reunión","UT_TRAFICO_VEHICULAR","TRAIN","Reynosa, Tamaulipas, 88500, México","88500","Tamaulipas"
3,2,"C","Hogar",0,0,0,26.02464,-98.26098,"Hogar Reunión","UT_DENSIDAD","TRAIN","Calle Carlos Salinas de Gortari, Reynosa, Tamaulipas, 88500, México","88500","Tamaulipas"
4,2,"A","Hogar",0,0,0,26.04326,-98.23851,"Hogar Reunión","UT_DENSIDAD","TRAIN","Calle Guanajuato, Reynosa, Tamaulipas, 88500, México","88500","Tamaulipas"
5,2,"C","Hogar",0,0,0,26.06397,-98.26165,"Hogar Reunión","UT_DENSIDAD","TRAIN","Calle Lucía, Reynosa, Tamaulipas, 88500, México","88500","Tamaulipas"
7,2,"C","Hogar",0,0,0,26.08957,-98.33238,"Hogar Reunión","UT_DENSIDAD","TRAIN","Calle Washington, Reynosa, Tamaulipas, 88500, México","88500","Tamaulipas"
9,2,"C","Hogar",0,0,0,26.01405,-98.39384,"Hogar Reunión","UT_DENSIDAD","TRAIN","Avenida Vía México, Nuevo México, Reynosa, Tamaulipas, 88733, México","88733","Tamaulipas"
6,2,"C","Hogar",0,0,0,26.02745,-98.35609,"Hogar Reunión","UT_DENSIDAD","TRAIN","Oxxo, Calle Victoria, Reynosa, Tamaulipas, 88500, México","88500","Tamaulipas"
236,3,"B","Hogar",130,12,0,25.60325,-100.25761,"Hogar Reunión","UT_DENSIDAD","TRAIN","Pedregal de La Laguna, Pedregal La Silla, Monterrey, Nuevo León, 64978, México","64978","Nuevo León"
345,3,"A","Hogar",97.5,10,7,25.64527,-100.37938,"Clásico","UT_TRAFICO_VEHICULAR","TRAIN","Avenida Alfonso Reyes, Lomas del Valle, San Pedro Garza García, Nuevo León, 66220, México","66220","Nuevo León"
204,3,"AB","Base",122.4,12,0,25.65211,-100.37786,"Oficinistas","UT_TRAFICO_VEHICULAR","TRAIN","Avenida José Vasconcelos, San Pedro Garza García, Nuevo León, 66220, México","66220","Nuevo León"
214,3,"BC","Receso",127.36,11,0,25.66708,-100.2804,"Oficinistas","UT_GAS_URBANA","TRAIN","Oxxo, 12, Buenos Aires, Monterrey, Nuevo León, 64800, México","64800","Nuevo León"
846,3,"B","Hogar",85.22,10,0,25.65985,-100.34713,"Oficinistas","UT_DENSIDAD","TRAIN","Río Amacuzac, Del Valle, San Pedro Garza García, Nuevo León, 66267, México","66267","Nuevo León"
841,3,"B","Hogar",0,0,0,25.58732,-100.27536,"Hogar Reunión","UT_DENSIDAD","TRAIN","Camino Al Diente, Aurea, Monterrey, Nuevo León, 64978, México","64978","Nuevo León"
221,3,"AB","Receso",168.4,12,0,25.65854,-100.35639,"Oficinistas","UT_TRAFICO_VEHICULAR","TRAIN","488, Calle Río Guadalquivir, Del Valle, San Pedro Garza García, Nuevo León, 66266, México","66266","Nuevo León"
222,3,"AB","Receso",112,9,0,25.6544,-100.29456,"Oficinistas","UT_DENSIDAD","TRAIN","Roma, Monterrey, Nuevo León, 64700, México","64700","Nuevo León"
827,3,"B","Base",0,0,0,25.52392,-100.20669,"Hogar Reunión","UT_TRAFICO_VEHICULAR","TRAIN","MEX 85, Monterrey, Nuevo León, 64102, México","64102","Nuevo León"
234,3,"A","Receso",111.14,12,0,25.65389,-100.34217,"Parada Técnica","UT_DENSIDAD","TRAIN","415, Calle Montes Rocallosos, Residencial San Agustin, San Pedro Garza García, Nuevo León, 66260, México","66260","Nuevo León"
246,3,"B","Base",100.57,14,0,25.64233,-100.27841,"Clásico","UT_TRAFICO_VEHICULAR","TRAIN","269, Avenida Alfonso Reyes, Contry Tesoro, Monterrey, Nuevo León, 64859, México","64859","Nuevo León"
167,3,"BC","Hogar",0,8,0,25.64782,-100.27427,"Clásico","UT_GAS_URBANA","TRAIN","Bahía de Las Islas, Bahía de la Primavera, Monterrey, Nuevo León, 64830, México","64830","Nuevo León"
237,3,"B","Hogar",127.64,12,0,25.64791,-100.29759,"Clásico","UT_DENSIDAD","TRAIN","María Curie, Roma, Monterrey, Nuevo León, 64700, México","64700","Nuevo León"
804,3,"B","Hogar",0,0,0,25.54712,-100.23021,"Hogar Reunión","UT_DENSIDAD","TRAIN","Del Acueducto, Carolco, Monterrey, Nuevo León, 64985, México","64985","Nuevo León"
243,3,"AB","Receso",149.7,11,0,25.63751,-100.31216,"Parada Técnica","UT_GAS_URBANA","TRAIN","Oxxo, Avenida Adolfo Laubner, Valle Oriente, Monterrey, Nuevo León, 64750, México","64750","Nuevo León"
242,3,"BC","Receso",0,8,0,25.65538,-100.29421,"Oficinistas","UT_GAS_URBANA","TRAIN","Oxxo, Calle Pirineos, Monterrey, Nuevo León, 64700, México","64700","Nuevo León"
241,3,"BC","Receso",97.31,10,0,25.67252,-100.35968,"Oficinistas","UT_TRAFICO_VEHICULAR","TRAIN","3008, Avenida Doctor Ignacio Morones Prieto, Del Carmen, Monterrey, Nuevo León, 64640, México","64640","Nuevo León"
178,3,"AB","Base",103.6,11,0,25.66035,-100.38279,"Oficinistas","UT_TRAFICO_VEHICULAR","TRAIN","Oxxo, Avenida Humberto Lobo, San Pedro Garza García, Nuevo León, 66200, México","66200","Nuevo León"
207,3,"AB","Base",93.6,10,0,25.65248,-100.36226,"Oficinistas","UT_TRAFICO_VEHICULAR","TRAIN","Avenida José Vasconcelos, Del Valle, San Pedro Garza García, Nuevo León, 66268, México","66268","Nuevo León"
169,3,"AB","Base",119.3,10,0,25.65122,-100.33959,"Oficinistas","UT_DENSIDAD","TRAIN","Avenida Real San Agustín, Residencial San Agustin, San Pedro Garza García, Nuevo León, 66260, México","66260","Nuevo León"
171,3,"AB","Hogar",110.1,10,0,25.66523,-100.34199,"Clásico","UT_TRAFICO_PEATONAL","TRAIN","Calle Loma Florida, Loma Larga, Monterrey, Nuevo León, 64710, México","64710","Nuevo León"
173,3,"AB","Hogar",99,8,0,25.6217,-100.29776,"Hogar Reunión","UT_DENSIDAD","TRAIN","3208, Avenida Paseo del Acueducto, Del Paseo, Monterrey, Nuevo León, 64790, México","64790","Nuevo León"
174,3,"AB","Hogar",0,12,0,25.62244,-100.28191,"Hogar Reunión","UT_DENSIDAD","TRAIN","4012, Boulevard Acapulco, Las Brisas, Monterrey, Nuevo León, 64790, México","64790","Nuevo León"
175,3,"BC","Base",136,12,0,25.64811,-100.32974,"Parada Técnica","UT_GAS_URBANA","TRAIN","Pemex, Avenida Lázaro Cárdenas, Valle Oriente, San Pedro Garza García, Nuevo León, 66269, México","66269","Nuevo León"
176,3,"AB","Hogar",0,10,0,25.63944,-100.27006,"Clásico","UT_TRAFICO_PEATONAL","TRAIN","Río La Silla, Villa del Rio, Monterrey, Nuevo León, 64850, México","64850","Nuevo León"
177,3,"BC","Base",0,12,0,25.64667,-100.29488,"Clásico","UT_DENSIDAD","TRAIN","Oxxo, Avenida Río Pánuco, Monterrey, Nuevo León, 64840, México","64840","Nuevo León"
507,3,"C","Hogar",107.8,13,9,25.65665,-100.26909,"Hogar Reunión","UT_DENSIDAD","TRAIN","2134, Calle Licenciado José López Portillo, 25 de Noviembre, Guadalupe, Nuevo León, 67140, México","67140","Nuevo León"
179,3,"AB","Hogar",0,11,0,25.60124,-100.26406,"Clásico","UT_DENSIDAD","TRAIN","Oxxo, Lago Erie, Lagos del Bosque, Monterrey, Nuevo León, 64978, México","64978","Nuevo León"
181,3,"AB","Hogar",105.65,12,10,25.6296,-100.27825,"Clásico","UT_TRAFICO_VEHICULAR","TRAIN","Sagitario, Contry, Monterrey, Nuevo León, 64860, México","64860","Nuevo León"
184,3,"AB","Hogar",0,11,0,25.62076,-100.28546,"Clásico","UT_DENSIDAD","TRAIN","Paseo de Granada, Las Torres, Monterrey, Nuevo León, 64790, México","64790","Nuevo León"
185,3,"AB","Receso",106.96,12,6,25.66474,-100.38099,"Parada Técnica","UT_TRAFICO_VEHICULAR","TRAIN","Oxxo, 552, Calle Río Amazonas, Del Valle, San Pedro Garza García, Nuevo León, 66220, México","66220","Nuevo León"
349,3,"AB","Base",0,10,0,25.65609,-100.33998,"Parada Técnica","UT_DENSIDAD","TRAIN","Avenida Lázaro Cárdenas, San Pedro Garza García, Nuevo León, 66260, México","66260","Nuevo León"
504,3,"B","Hogar",0,13,0,25.62039,-100.28323,"Clásico","UT_TRAFICO_VEHICULAR","TRAIN","Lateral Avenida Lázaro Cárdenas, Monterrey, Nuevo León, 64790, México","64790","Nuevo León"
196,3,"BC","Receso",0,12,0,25.56563,-100.23929,"Parada Técnica","UT_CARRETERA_GAS","TRAIN","Carretera Nacional, Palmares, Monterrey, Nuevo León, 64984, México","64984","Nuevo León"
284,3,"C","Receso",124.6,18,0,25.53601,-100.21905,"Parada Técnica","UT_CARRETERA_GAS","TRAIN","Oxxo, A Gas 8599, Monterrey, Nuevo León, 64985, México","64985","Nuevo León"
725,3,"C","Hogar",0,0,0,25.66995,-100.27144,"Hogar Reunión","UT_DENSIDAD","TRAIN","1006, Florida, Paraiso, Guadalupe, Monterrey, Nuevo León, 67140, México","67140","Nuevo León"
316,3,"B","Base",98,9,0,25.65519,-100.35268,"Oficinistas","UT_TRAFICO_VEHICULAR","TRAIN","Avenida Ricardo Margáin Zozaya, Santa Engracia, San Pedro Garza García, Nuevo León, 66266, México","66266","Nuevo León"
271,3,"BC","Hogar",117.2,13,0,25.63876,-100.38256,"Clásico","UT_TRAFICO_VEHICULAR","TRAIN","Avenida Roberto Garza Sada, San Pedro Garza García, Nuevo León, 66268, México","66268","Nuevo León"
311,3,"C","Receso",101,10,0,25.59757,-100.26299,"Parada Técnica","UT_CARRETERA_GAS","TRAIN","Avenida Eugenio Garza Sada, Monterrey, Nuevo León, 64978, México","64978","Nuevo León"
604,3,"C","Hogar",0,13,0,25.62711,-100.28613,"Hogar Reunión","UT_DENSIDAD","TRAIN","3336, Puerto Castilla, Las Brisas, Monterrey, Nuevo León, 64790, México","64790","Nuevo León"
274,3,"C","Receso",105.3,14,0,25.56632,-100.23881,"Parada Técnica","UT_GAS_URBANA","TRAIN","Oxxo, A Gas 8522, Monterrey, Nuevo León, 64984, México","64984","Nuevo León"
276,3,"BC","Receso",109.82,17,0,25.66113,-100.39875,"Parada Técnica","UT_TRAFICO_VEHICULAR","TRAIN","Oxxo, Avenida José Vasconcelos, Casco Urbano, San Pedro Garza García, Nuevo León, 66239, México","66239","Nuevo León"
309,3,"B","Receso",77,14,0,25.65671,-100.36253,"Parada Técnica","UT_DENSIDAD","TRAIN","306, Calle Río Manzanares, Del Valle, San Pedro Garza García, Nuevo León, 66266, México","66266","Nuevo León"
308,3,"AB","Hogar",112.5,12,0,25.64252,-100.33347,"Clásico","UT_TRAFICO_VEHICULAR","TRAIN","Avenida Eugenio Garza Lagüera, Hacienda San Agustín, San Pedro Garza García, Nuevo León, 66278, México","66278","Nuevo León"
584,3,"C","Hogar",0,13,0,25.66242,-100.29553,"Hogar Reunión","UT_DENSIDAD","TRAIN","Calle 3a. Zona, Caracol, Monterrey, Nuevo León, 64820, México","64820","Nuevo León"
287,3,"AB","Base",105.34,17,0,25.58131,-100.25847,"Clásico","UT_DENSIDAD","TRAIN","Calle Rincón Valle Alto, Rincón de Valle Alto, Monterrey, Nuevo León, 64989, México","64989","Nuevo León"
656,3,"C","Base",0,0,0,25.66196,-100.31357,"Parada Técnica","UT_GAS_URBANA","TRAIN","Avenida Doctor Ignacio Morones Prieto, Monterrey, Nuevo León, 64000, México","64000","Nuevo León"
629,3,"C","Hogar",0,0,0,25.6821,-100.41138,"Hogar Reunión","UT_DENSIDAD","TRAIN","OXXO, Avenida General Emiliano Zapata, Unidad Habitacional Revolución, San Pedro Garza García, Nuevo León, 66216, México","66216","Nuevo León"
295,3,"C","Receso",108,16,0,25.65979,-100.39622,"Oficinistas","UT_TRAFICO_VEHICULAR","TRAIN","902, Avenida José Vasconcelos, Casco Urbano, San Pedro Garza García, Nuevo León, 66239, México","66239","Nuevo León"
303,3,"B","Base",88,12,0,25.65706,-100.38443,"Oficinistas","UT_TRAFICO_VEHICULAR","TRAIN","BreAd Panaderos Artesanales, 545A, Avenida Humberto Lobo, Del Valle, San Pedro Garza García, Nuevo León, 66220, México","66220","Nuevo León"
638,3,"C","Receso",0,0,0,25.66655,-100.27964,"Parada Técnica","UT_TRAFICO_VEHICULAR","TRAIN","Avenida Chapultepec, Buenos Aires, Monterrey, Nuevo León, 64800, México","64800","Nuevo León"
567,3,"B","Base",0,13,0,25.64856,-100.3572,"Parada Técnica","UT_TRAFICO_PEATONAL","TRAIN","407, Boulevard Botánica, Zona Montebello, San Pedro Garza García, Nuevo León, 66279, México","66279","Nuevo León"
553,3,"B","Base",0,13,0,25.62432,-100.29972,"Hogar Reunión","UT_TRAFICO_VEHICULAR","TRAIN","Avenida Fundadores, La República, Monterrey, Nuevo León, 64920, México","64920","Nuevo León"
554,3,"C","Receso",0,0,0,25.65033,-100.3553,"Oficinistas","UT_DENSIDAD","TRAIN","Avenida Roble, Valle de Campestre, San Pedro Garza García, Nuevo León, 66265, México","66265","Nuevo León"
